{
  "name": "godwinmix-plugins",
  "title": "GodwinMix plugins",
  "description": "Every listed GodwinMix plugin, read from its own repository once a day: what it does, its pictures, its stars and how often it was downloaded.",
  "owner": "psmux",
  "version": 1,
  "plugins": [
    {
      "name": "audio-device",
      "source": "./plugins/audio-device",
      "title": "Microphone and sound card",
      "description": "A microphone, a line input or a sound card as a source: PipeWire or PulseAudio on Linux, Core Audio on macOS, WASAPI on Windows, with gain and mute and device discovery.",
      "tier": "gold",
      "kinds": [
        "source",
        "device"
      ],
      "license": "Apache-2.0",
      "repository": "https://github.com/psmux/GodwinMix/tree/main/plugins/audio-device",
      "homepage": "https://godwinmix.ripeflow.com",
      "author": "GodwinMix",
      "stars": 10,
      "updated": "2026-10-08T12:31:29Z",
      "tags": [
        "broadcaster",
        "headend",
        "rtmp",
        "rtmp-broadcaster",
        "rtmp-client",
        "rtmp-server",
        "rtmp-stream",
        "rtmp-streaming",
        "rtmps",
        "streaming",
        "streaming-app",
        "streaming-tools",
        "streaming-video",
        "video",
        "video-encoder",
        "video-encoding",
        "video-mixing",
        "video-mixing-software",
        "video-streaming"
      ],
      "bundled": true,
      "versions": [
        {
          "version": "0.1.0",
          "api": 1,
          "platforms": [
            "linux-x86_64",
            "linux-aarch64",
            "linux-armv7",
            "macos-aarch64",
            "macos-x86_64",
            "windows-x86_64"
          ],
          "signed": false
        }
      ]
    },
    {
      "name": "camera",
      "source": "./plugins/camera",
      "title": "Camera",
      "description": "A USB or built in camera as a source: v4l2 on Linux, AVFoundation on macOS, Kernel Streaming then Media Foundation on Windows, with device discovery and a resolution and frame rate you can set.",
      "tier": "gold",
      "kinds": [
        "source",
        "device"
      ],
      "license": "Apache-2.0",
      "repository": "https://github.com/psmux/GodwinMix/tree/main/plugins/camera",
      "homepage": "https://godwinmix.ripeflow.com",
      "author": "GodwinMix",
      "stars": 10,
      "updated": "2026-10-05T14:22:58Z",
      "tags": [
        "broadcaster",
        "headend",
        "rtmp",
        "rtmp-broadcaster",
        "rtmp-client",
        "rtmp-server",
        "rtmp-stream",
        "rtmp-streaming",
        "rtmps",
        "streaming",
        "streaming-app",
        "streaming-tools",
        "streaming-video",
        "video",
        "video-encoder",
        "video-encoding",
        "video-mixing",
        "video-mixing-software",
        "video-streaming"
      ],
      "bundled": true,
      "versions": [
        {
          "version": "0.1.0",
          "api": 1,
          "platforms": [
            "linux-x86_64",
            "linux-aarch64",
            "linux-armv7",
            "macos-aarch64",
            "macos-x86_64",
            "windows-x86_64"
          ],
          "signed": false
        }
      ]
    },
    {
      "name": "decklink",
      "source": "./plugins/decklink",
      "title": "Blackmagic DeckLink",
      "description": "SDI and HDMI capture through a Blackmagic DeckLink card: picture and embedded sound, the connector and video mode chosen or detected, and every input the driver reports found by itself.",
      "tier": "custom",
      "kinds": [
        "source",
        "device"
      ],
      "license": "Apache-2.0",
      "repository": "https://github.com/psmux/GodwinMix/tree/main/plugins/decklink",
      "homepage": "https://godwinmix.ripeflow.com",
      "author": "GodwinMix",
      "stars": 10,
      "updated": "2026-10-03T08:40:24Z",
      "tags": [
        "broadcaster",
        "headend",
        "rtmp",
        "rtmp-broadcaster",
        "rtmp-client",
        "rtmp-server",
        "rtmp-stream",
        "rtmp-streaming",
        "rtmps",
        "streaming",
        "streaming-app",
        "streaming-tools",
        "streaming-video",
        "video",
        "video-encoder",
        "video-encoding",
        "video-mixing",
        "video-mixing-software",
        "video-streaming"
      ],
      "bundled": true,
      "versions": [
        {
          "version": "0.1.0",
          "api": 1,
          "platforms": [
            "linux-x86_64",
            "linux-aarch64",
            "macos-aarch64",
            "macos-x86_64",
            "windows-x86_64"
          ],
          "signed": false
        }
      ]
    },
    {
      "name": "director",
      "source": "./plugins/director",
      "title": "Auto director",
      "description": "An automatic director: rule based out of the box, and able to consult a model when one is configured",
      "tier": "gold",
      "kinds": [
        "service"
      ],
      "license": "Apache-2.0",
      "repository": "https://github.com/psmux/GodwinMix/tree/main/plugins/director",
      "homepage": "https://godwinmix.ripeflow.com",
      "author": "GodwinMix",
      "stars": 10,
      "updated": "2026-10-03T08:40:24Z",
      "tags": [
        "broadcaster",
        "headend",
        "rtmp",
        "rtmp-broadcaster",
        "rtmp-client",
        "rtmp-server",
        "rtmp-stream",
        "rtmp-streaming",
        "rtmps",
        "streaming",
        "streaming-app",
        "streaming-tools",
        "streaming-video",
        "video",
        "video-encoder",
        "video-encoding",
        "video-mixing",
        "video-mixing-software",
        "video-streaming"
      ],
      "bundled": true,
      "versions": [
        {
          "version": "0.2.0",
          "api": 1,
          "platforms": [
            "linux-x86_64",
            "linux-aarch64",
            "macos-aarch64",
            "macos-x86_64",
            "windows-x86_64"
          ],
          "signed": false
        }
      ]
    },
    {
      "name": "file-record",
      "source": "./plugins/file-record",
      "title": "Record to a file",
      "description": "Record the programme to a file: fragmented MP4 so a crash leaves something playable, or Matroska; a path pattern with the date and time, splitting by the clock, and a disk space check that says so before the disk fills.",
      "tier": "gold",
      "kinds": [
        "output"
      ],
      "license": "Apache-2.0",
      "repository": "https://github.com/psmux/GodwinMix/tree/main/plugins/file-record",
      "homepage": "https://godwinmix.ripeflow.com",
      "author": "GodwinMix",
      "stars": 10,
      "updated": "2026-10-03T14:59:30Z",
      "tags": [
        "broadcaster",
        "headend",
        "rtmp",
        "rtmp-broadcaster",
        "rtmp-client",
        "rtmp-server",
        "rtmp-stream",
        "rtmp-streaming",
        "rtmps",
        "streaming",
        "streaming-app",
        "streaming-tools",
        "streaming-video",
        "video",
        "video-encoder",
        "video-encoding",
        "video-mixing",
        "video-mixing-software",
        "video-streaming"
      ],
      "bundled": true,
      "versions": [
        {
          "version": "0.1.0",
          "api": 1,
          "platforms": [
            "linux-x86_64",
            "linux-aarch64",
            "linux-armv7",
            "macos-aarch64",
            "macos-x86_64",
            "windows-x86_64"
          ],
          "signed": false
        }
      ]
    },
    {
      "name": "icecast",
      "source": "./plugins/icecast",
      "title": "Icecast radio",
      "description": "Internet radio both ways: the programme's sound to an Icecast or SHOUTcast 2 server as MP3 or Ogg, and a radio station or any audio stream over HTTP as a live source.",
      "tier": "custom",
      "kinds": [
        "output",
        "source"
      ],
      "license": "Apache-2.0",
      "repository": "https://github.com/psmux/GodwinMix/tree/main/plugins/icecast",
      "homepage": "https://godwinmix.ripeflow.com",
      "author": "GodwinMix",
      "stars": 10,
      "updated": "2026-10-10T17:55:34Z",
      "tags": [
        "broadcaster",
        "headend",
        "rtmp",
        "rtmp-broadcaster",
        "rtmp-client",
        "rtmp-server",
        "rtmp-stream",
        "rtmp-streaming",
        "rtmps",
        "streaming",
        "streaming-app",
        "streaming-tools",
        "streaming-video",
        "video",
        "video-encoder",
        "video-encoding",
        "video-mixing",
        "video-mixing-software",
        "video-streaming"
      ],
      "bundled": true,
      "versions": [
        {
          "version": "0.1.0",
          "api": 1,
          "platforms": [
            "linux-x86_64",
            "linux-aarch64",
            "macos-aarch64",
            "macos-x86_64",
            "windows-x86_64"
          ],
          "signed": false
        }
      ]
    },
    {
      "name": "ingest",
      "source": "./plugins/ingest",
      "title": "Ingest server",
      "description": "GodwinMix as a server: channels an OBS, a phone, a hardware encoder or a browser publish to by RTMP, RTMPS, SRT or WHIP, one port per protocol for every channel and none open until a channel needs it, and a standalone RTMP listener and WHIP endpoint for one publisher each.",
      "tier": "gold",
      "kinds": [
        "source",
        "device"
      ],
      "license": "Apache-2.0",
      "repository": "https://github.com/psmux/GodwinMix/tree/main/plugins/ingest",
      "homepage": "https://godwinmix.ripeflow.com",
      "author": "GodwinMix",
      "stars": 10,
      "updated": "2026-10-28T06:52:14Z",
      "tags": [
        "broadcaster",
        "headend",
        "rtmp",
        "rtmp-broadcaster",
        "rtmp-client",
        "rtmp-server",
        "rtmp-stream",
        "rtmp-streaming",
        "rtmps",